{"artifactDocument":{"dependencyFormat":"yuho.dependency-plan/v0.1-experimental","dependencyPlan":{"planBindings":[],"planCandidates":[{"candidateGuard":{"portCategory":"typed.expression.truth","portComponent":"s","portObject":"q:target"},"candidateIdentity":"candidate:target","candidateLocation":null,"candidateModality":"unspecified","candidatePolicy":"yuho.condition-identity/v1","candidateRationale":"Technical candidate only","candidateReferences":["origin"],"candidateScope":"scope:a","candidateTerm":{"termValue":{"kind":"life_imprisonment","span":{"end":0,"end_col":1,"end_line":1,"start":0,"start_col":1,"start_line":1},"term_id":"term:life"}}}],"planComponents":[{"componentEntities":[["person:a","project:a"],["event:i","project:i"]],"componentEntry":null,"componentIdentity":"s","componentLocation":null,"componentModel":"","componentNominals":[["person","role:person"],["event","role:event"]],"componentProfile":"native-typed","componentRationale":"Explicit actual identity maps","componentScenario":null,"componentScope":"scope:a","componentTemplate":{"templateConditions":[],"templateEntities":[["person:a","person"],["event:i","event"],["a(b","person"],["b","person"]],"templateEntityTypes":["person","event"],"templateFacts":[["p",["a(b"],"Satisfied","Fact for the other predicate and entity only"]],"templateIdentity":"Control","templateLimitations":["Fictional independent collision control"],"templatePredicates":[["p",["person"]],["p(a",["person"]]],"templatePropositions":[],"templateRequirements":[["q:target",{"contents":["p(a",["b"]],"tag":"TemplateAtom"}]],"templateRules":[]}}],"planIdentity":"collision-review","planOrigins":[{"originIdentity":"origin","originLocator":"urn:independent:collision"}],"planScopes":[{"scopeActor":"project:a","scopeAllegation":null,"scopeCase":null,"scopeContext":"project:i","scopeEntities":[["project:a","role:person"],["project:i","role:event"]],"scopeIdentity":"scope:a"}]},"dependencyProjectSource":null,"dependencySources":{}},"artifactExecutionDigest":"1ab5f55f5dbacd388d1e6ce5ca5b25ac8196ea08945fb7661f8712fa925f27dd","artifactFormatVersion":"yuho.dependency-artifact/v0.1-experimental","artifactSourceDigest":"730510c1cc532667bb5ba8af84ee9a7bc09ce81406dbf0f1087184d915c96a1b"}