{"artifactDocument":{"dependencyFormat":"yuho.dependency-plan/v0.1-experimental","dependencyPlan":{"planBindings":[{"bindingComponent":"d","bindingIdentity":"conflict","bindingLocation":null,"bindingPolicy":"yuho.proposition-support/v1","bindingPort":{"portCategory":"typed.proposition.resolution","portComponent":"s","portObject":"p:conflict"},"bindingRationale":"Technical support only; original conflict retained","bindingReferences":["origin"],"bindingSlot":"in:conflict"}],"planCandidates":[{"candidateGuard":{"portCategory":"typed.expression.truth","portComponent":"d","portObject":"q:independent"},"candidateIdentity":"candidate:independent","candidateLocation":null,"candidateModality":"unspecified","candidatePolicy":"yuho.condition-identity/v1","candidateRationale":"Technical candidate only","candidateReferences":["origin"],"candidateScope":"scope:a","candidateTerm":{"termValue":{"kind":"life_imprisonment","span":{"end":0,"end_col":1,"end_line":1,"start":0,"start_col":1,"start_line":1},"term_id":"term:life"}}}],"planComponents":[{"componentEntities":[["person:a","project:a"],["event:i","project:i"]],"componentEntry":null,"componentIdentity":"s","componentLocation":null,"componentModel":"source.yh","componentNominals":[["person","role:person"],["event","role:event"]],"componentProfile":"native-typed","componentRationale":"Explicit actual identity maps","componentScenario":"facts.yh","componentScope":"scope:a","componentTemplate":null},{"componentEntities":[["person:a","project:a"],["event:i","project:i"]],"componentEntry":null,"componentIdentity":"d","componentLocation":null,"componentModel":"","componentNominals":[["person","role:person"],["event","role:event"]],"componentProfile":"native-typed","componentRationale":"Explicit actual identity maps","componentScenario":null,"componentScope":"scope:a","componentTemplate":{"templateConditions":["in:conflict"],"templateEntities":[["person:a","person"],["event:i","event"]],"templateEntityTypes":["person","event"],"templateFacts":[["own",["person:a","event:i"],"NotSatisfied","Independent false fact"]],"templateIdentity":"Control","templateLimitations":["Fictional independent collision control"],"templatePredicates":[["own",["person","event"]]],"templatePropositions":[],"templateRequirements":[["dep_196b0dbc43470dceadf1a4a3d180dace37e62e47d75b025dbf7a8c78b70429b8(dep_template_entity)",{"contents":["own",["person:a","event:i"]],"tag":"TemplateAtom"}],["q:independent",{"contents":"dep_196b0dbc43470dceadf1a4a3d180dace37e62e47d75b025dbf7a8c78b70429b8(dep_template_entity)","tag":"TemplateReference"}],["q:uses-slot",{"contents":"in:conflict","tag":"TemplateCondition"}]],"templateRules":[]}}],"planIdentity":"collision-review","planOrigins":[{"originIdentity":"origin","originLocator":"urn:independent:collision"}],"planScopes":[{"scopeActor":"project:a","scopeAllegation":null,"scopeCase":null,"scopeContext":"project:i","scopeEntities":[["project:a","role:person"],["project:i","role:event"]],"scopeIdentity":"scope:a"}]},"dependencyProjectSource":null,"dependencySources":{"facts.yh":"typed-rules-scenario Facts for Control { classify support(person:a,event:i) as proved reason \"support\"; classify defeat(person:a,event:i) as proved reason \"defeat\"; classify independent(person:a,event:i) as unresolved reason \"unknown independent\"; classify falsehood(person:a,event:i) as not_proved reason \"false\"; }\n","source.yh":"typed-rules-model Control { limit 2048; entity-type person; entity-type event; entity person:a as person; entity event:i as event;\npredicate support(person,event) kind relationship; predicate defeat(person,event) kind relationship; predicate independent(person,event) kind relationship; predicate falsehood(person,event) kind relationship; proposition p:conflict; requirement q:s = support(person:a,event:i); requirement q:d = defeat(person:a,event:i); requirement q:unknown = independent(person:a,event:i); requirement q:false = falsehood(person:a,event:i); rule r:s establishes proposition p:conflict when q:s; rule r:d defeats proposition p:conflict when q:d;\nlimitation \"Fictional engineering model; no legal conclusion\"; }\n"}},"artifactExecutionDigest":"3643741a598e2ad293bb199e831c676ae88e62f36bc9081ccdd4576385bb1a81","artifactFormatVersion":"yuho.dependency-artifact/v0.1-experimental","artifactSourceDigest":"d62964d40d0ae9c875a6f146e2fbe2f08404dd761ea337eb4fcd5663cc897a3d"}